{
 "paper_title": "Pulsar Polarization Array Limits on Ultralight Axion-like Dark Matter",
 "coupling_type": "AxionPhoton",
 "is_new_limit": true,
 "is_projection": false,
 "data_points": [
  [
   3.16261e-24,
   1.43045e-14
  ],
  [
   3.98149e-24,
   1.01737e-14
  ],
  [
   5.0124e-24,
   8.38458e-15
  ],
  [
   6.31024e-24,
   6.24435e-15
  ],
  [
   7.94412e-24,
   6.11629e-15
  ],
  [
   1.00011e-23,
   8.56015e-15
  ],
  [
   1.25906e-23,
   2.50876e-14
  ],
  [
   1.58506e-23,
   3.93959e-14
  ],
  [
   1.99547e-23,
   4.06865e-14
  ],
  [
   2.51215e-23,
   2.76349e-14
  ],
  [
   3.16261e-23,
   2.80839e-14
  ],
  [
   3.98149e-23,
   3.64295e-14
  ],
  [
   5.0124e-23,
   5.01703e-14
  ],
  [
   6.31024e-23,
   4.51283e-14
  ],
  [
   7.94412e-23,
   3.81463e-14
  ],
  [
   1.00011e-22,
   3.35316e-14
  ],
  [
   1.25906e-22,
   1.9117e-13
  ],
  [
   1.58506e-22,
   1.57552e-13
  ],
  [
   1.99547e-22,
   3.28439e-14
  ],
  [
   2.51215e-22,
   9.10826e-14
  ],
  [
   3.16261e-22,
   1.80893e-13
  ],
  [
   3.98149e-22,
   2.21013e-13
  ],
  [
   5.0124e-22,
   3.03677e-13
  ],
  [
   6.31024e-22,
   2.53172e-13
  ],
  [
   7.94412e-22,
   5.86677e-13
  ],
  [
   1.00011e-21,
   2.46273e-13
  ],
  [
   1.25906e-21,
   6.98868e-13
  ],
  [
   1.58506e-21,
   8.77792e-13
  ],
  [
   1.99547e-21,
   1.34086e-12
  ],
  [
   2.51215e-21,
   2.53729e-12
  ],
  [
   3.16261e-21,
   1.44006e-12
  ],
  [
   3.98149e-21,
   3.62546e-12
  ],
  [
   5.0124e-21,
   3.10718e-12
  ],
  [
   6.31024e-21,
   3.07162e-12
  ],
  [
   7.94412e-21,
   3.25361e-12
  ],
  [
   1.00011e-20,
   2.70626e-12
  ],
  [
   1.25906e-20,
   3.43056e-12
  ],
  [
   1.58506e-20,
   6.05834e-12
  ],
  [
   1.99547e-20,
   8.61682e-12
  ],
  [
   2.51215e-20,
   6.9239e-12
  ],
  [
   3.16261e-20,
   1.14378e-11
  ],
  [
   3.98149e-20,
   3.29854e-11
  ],
  [
   5.0124e-20,
   6.53526e-10
  ],
  [
   6.31024e-20,
   1.63055e-11
  ],
  [
   7.94412e-20,
   2.47929e-11
  ],
  [
   1.00011e-19,
   6.58056e-10
  ],
  [
   1.25906e-19,
   1.58961e-10
  ],
  [
   1.58506e-19,
   8.97959e-10
  ],
  [
   1.99547e-19,
   9.51165e-10
  ],
  [
   2.51215e-19,
   8.18952e-10
  ],
  [
   3.16261e-19,
   5.48614e-10
  ]
 ],
 "data_source": "figure_vector",
 "dm_density_assumed": 0.4,
 "confidence_level": 0.95,
 "extraction_confidence": 0.93,
 "suggested_experiment_name": "PPTA_2024",
 "coupling_convention": "g_agamma [GeV^-1]",
 "notes": "PPTA DR3 pulsar polarization array (PPPA) 95% upper limits on the ALDM Chern-Simons coupling g_agamma vs m_a, Fig. 2 of the paper (eprint file Figures_new/constraint_main.pdf), red SOLID curve = full-correlation signal model with ionospheric subtraction, which the paper presents as the final/headline limit (the blue curve is the autocorrelation-only model; dashed = without ionospheric subtraction; lower subpanel Bayes factors not extracted). Vector extraction from the matplotlib PDF: x-axis calibrated on major ticks (log10 m = -23..-19, 86.4 px/decade) and cross-checked against the '1 day' and '1 year' vertical reference lines (agreement <0.2 px); y-axis on major ticks log10 g = -9..-14. Cross-check with text: extracted curve gives g <= 10^-13.5 - 10^-12.2 GeV^-1 over 10^-22 - 10^-21 eV, exactly as quoted. Assumes local DM density rho0 = 0.4 GeV/cm^3 (paper benchmark, stated in Fig. 2 caption). Curve is the paper's native 51-vertex polyline spanning 3.2e-24 to 3.2e-19 eV; oscillatory structure (peaks near 1/yr and >1e-19.4 eV) is genuine in the published limit.",
 "num_points": 51,
 "arxiv_id": "2412.02229",
 "elapsed_s": 169.86153292655945,
 "meta": {
  "system": "agent_claude_code",
  "driver_version": "0.1.4",
  "task_card_sha256": "8504fc84a3b55be2f4639757d6c68fbd107d634ff847fc99b954263eb31c415f",
  "model_requested": "claude-fable-5",
  "models_billed": [
   "claude-fable-5"
  ],
  "effort": "default",
  "transport": "cli",
  "timed_out": false,
  "wrote_result_json": true,
  "cli_is_error": false,
  "cli_subtype": "success",
  "cli_returncode": 0,
  "num_turns": 16,
  "duration_ms": 169362,
  "duration_api_ms": 166258,
  "total_cost_usd": 1.6850580000000002,
  "usage": {
   "input_tokens": 411,
   "output_tokens": 12993,
   "cache_creation_input_tokens": 41624,
   "cache_read_input_tokens": 453143
  },
  "leak_suspect": false,
  "leak_patterns": [],
  "schema_problems": [],
  "events_file": "2412.02229.events.jsonl",
  "attempt": 0,
  "finished_at": "2026-09-16T22:34:14-0500",
  "leak_audit": "strict-v2 (agent-issued only)"
 }
}