{
 "paper_title": "First Results from a Broadband Search for Dark Photon Dark Matter in the 44 to 52 ueV Range with a Coaxial Dish Antenna",
 "coupling_type": "DarkPhoton",
 "is_new_limit": true,
 "is_projection": false,
 "data_points": [
  [
   4.4217e-05,
   9.837e-13
  ],
  [
   4.4382e-05,
   9.026e-13
  ],
  [
   4.4548e-05,
   9.837e-13
  ],
  [
   4.4719e-05,
   8.558e-13
  ],
  [
   4.4885e-05,
   9.063e-13
  ],
  [
   4.5055e-05,
   8.454e-13
  ],
  [
   4.5221e-05,
   8.953e-13
  ],
  [
   4.5387e-05,
   9.176e-13
  ],
  [
   4.5558e-05,
   9.404e-13
  ],
  [
   4.5724e-05,
   8.807e-13
  ],
  [
   4.5894e-05,
   9.289e-13
  ],
  [
   4.606e-05,
   9.599e-13
  ],
  [
   4.6226e-05,
   1.029e-12
  ],
  [
   4.6396e-05,
   9.638e-13
  ],
  [
   4.6562e-05,
   9.443e-13
  ],
  [
   4.6733e-05,
   9.404e-13
  ],
  [
   4.6899e-05,
   1e-12
  ],
  [
   4.7065e-05,
   9.52e-13
  ],
  [
   4.7235e-05,
   9.878e-13
  ],
  [
   4.7401e-05,
   1.008e-12
  ],
  [
   4.7571e-05,
   9.878e-13
  ],
  [
   4.7737e-05,
   9.559e-13
  ],
  [
   4.7908e-05,
   9.404e-13
  ],
  [
   4.8074e-05,
   8.807e-13
  ],
  [
   4.824e-05,
   8.629e-13
  ],
  [
   4.841e-05,
   8.916e-13
  ],
  [
   4.8576e-05,
   8.419e-13
  ],
  [
   4.8747e-05,
   8.735e-13
  ],
  [
   4.8912e-05,
   8.843e-13
  ],
  [
   4.9078e-05,
   8.843e-13
  ],
  [
   4.9249e-05,
   8.282e-13
  ],
  [
   4.9415e-05,
   8.843e-13
  ],
  [
   4.9585e-05,
   8.454e-13
  ],
  [
   4.9751e-05,
   8.843e-13
  ],
  [
   4.9917e-05,
   8.35e-13
  ],
  [
   5.0088e-05,
   8.771e-13
  ],
  [
   5.0253e-05,
   8.558e-13
  ],
  [
   5.0424e-05,
   8.7e-13
  ],
  [
   5.059e-05,
   8.282e-13
  ],
  [
   5.0756e-05,
   8.593e-13
  ],
  [
   5.0926e-05,
   8.015e-13
  ],
  [
   5.1092e-05,
   8.081e-13
  ],
  [
   5.1263e-05,
   7.885e-13
  ],
  [
   5.1429e-05,
   7.917e-13
  ],
  [
   5.1599e-05,
   7.95e-13
  ]
 ],
 "data_source": "figure_vision",
 "dm_density_assumed": 0.45,
 "confidence_level": 0.9,
 "extraction_confidence": 0.85,
 "suggested_experiment_name": "GigaBREAD_2024",
 "coupling_convention": "kinetic mixing chi (dimensionless)",
 "notes": "GigaBREAD (BREAD collaboration) dish-antenna dark photon DM search. Main result: orange excluded region GigaBREAD-0 in Fig.4 (right/magnified panel), 90% CL. Curve is the lower (bottom) boundary of the orange excluded region = the chi(m) upper limit, extracted by pixel analysis of raster figure exclusion.png (no vector/ancillary data in e-print). Axis calibration: y-decade label rows 738/1305/1862/2424/2986 for 1e-10..1e-14; x frame 6243=40ueV, 9498=55ueV. Limit is nearly flat at chi~=8-10e-13 (~1e-12) over ~44.2-51.6 ueV, consistent with abstract chi<~1e-12 for 44-52 ueV. Assumes rho_DM=0.45 GeV/cm^3 and random polarization alpha^2=1/3 (Eq.1). Orange region shown only up to ~51.6 ueV where BRASS-p becomes more stringent; GigaBREAD data span 10.7-12.5 GHz (44-52 ueV).",
 "num_points": 45,
 "arxiv_id": "2310.13891",
 "elapsed_s": 287.6565420627594,
 "meta": {
  "system": "agent_claude_code",
  "driver_version": "0.1.4",
  "task_card_sha256": "8504fc84a3b55be2f4639757d6c68fbd107d634ff847fc99b954263eb31c415f",
  "model_requested": "claude-opus-4-8",
  "models_billed": [
   "claude-opus-4-8"
  ],
  "effort": "default",
  "transport": "cli",
  "timed_out": false,
  "wrote_result_json": true,
  "cli_is_error": false,
  "cli_subtype": "success",
  "cli_returncode": 0,
  "num_turns": 32,
  "duration_ms": 287331,
  "duration_api_ms": 269058,
  "total_cost_usd": 1.3411974999999998,
  "usage": {
   "input_tokens": 891,
   "output_tokens": 16750,
   "cache_creation_input_tokens": 43675,
   "cache_read_input_tokens": 962485
  },
  "leak_suspect": false,
  "leak_patterns": [],
  "schema_problems": [],
  "events_file": "2310.13891.events.jsonl",
  "attempt": 0,
  "finished_at": "2026-09-18T01:55:40-0500"
 }
}