{
 "paper_title": "Axion-Induced Patchy Screening of the Cosmic Microwave Background",
 "coupling_type": "AxionPhoton",
 "is_new_limit": false,
 "is_projection": true,
 "data_points": [],
 "data_source": "none",
 "dm_density_assumed": null,
 "confidence_level": 0.95,
 "extraction_confidence": 0.95,
 "suggested_experiment_name": "CMB_PatchyScreening_2024",
 "coupling_convention": "g_agamma [GeV^-1]",
 "notes": "This paper forecasts the sensitivity of CMB patchy-screening searches (photon-axion conversion in LSS magnetic fields) to g_agamma for axion masses 2e-13 to 3e-12 eV. It performs no data analysis; it projects that a Planck+unWISE component-separated <T^a g> analysis could reach g_agamma ~ 3e-12 GeV^-1, and CMB-S4 could extend this by ~1 order of magnitude. Abstract and Sec. 1/4 state these are forecasts, and the actual data analysis is deferred to a separate future publication (ref [43]). Therefore is_projection=true and no measured limit is reported.",
 "num_points": 0,
 "arxiv_id": "2405.08059",
 "elapsed_s": 16.031348943710327,
 "meta": {
  "system": "agent_claude_code",
  "driver_version": "0.1.4",
  "task_card_sha256": "8504fc84a3b55be2f4639757d6c68fbd107d634ff847fc99b954263eb31c415f",
  "model_requested": "claude-opus-4-8",
  "models_billed": [
   "claude-opus-4-8"
  ],
  "effort": "default",
  "transport": "cli",
  "timed_out": false,
  "wrote_result_json": true,
  "cli_is_error": false,
  "cli_subtype": "success",
  "cli_returncode": 0,
  "num_turns": 4,
  "duration_ms": 15647,
  "duration_api_ms": 15124,
  "total_cost_usd": 0.2592185,
  "usage": {
   "input_tokens": 84,
   "output_tokens": 996,
   "cache_creation_input_tokens": 21005,
   "cache_read_input_tokens": 47697
  },
  "leak_suspect": false,
  "leak_patterns": [],
  "schema_problems": [],
  "events_file": "2405.08059.events.jsonl",
  "attempt": 0,
  "finished_at": "2026-09-18T02:17:15-0500"
 }
}