{
 "paper_title": "Constraining Axion-Like Particles with HAWC Observations of TeV Blazars",
 "coupling_type": "AxionPhoton",
 "is_new_limit": true,
 "is_projection": false,
 "data_points": [
  [
   1.0333346678700776e-11,
   8.473248999999999e-11
  ],
  [
   1.1367788896344668e-11,
   3.931183999999999e-11
  ],
  [
   1.2746706909363345e-11,
   3.8867989999999994e-11
  ],
  [
   1.4022743819085648e-11,
   3.931183999999999e-11
  ],
  [
   1.5723709083342195e-11,
   3.8720039999999994e-11
  ],
  [
   2.1337670284111676e-11,
   3.8424139999999994e-11
  ],
  [
   2.7871798911119987e-11,
   3.8867989999999994e-11
  ],
  [
   3.185473525444299e-11,
   3.857208999999999e-11
  ],
  [
   4.241104758550169e-11,
   3.8867989999999994e-11
  ],
  [
   5.132736861678096e-11,
   3.9163889999999994e-11
  ],
  [
   5.646560685349946e-11,
   3.8720039999999994e-11
  ],
  [
   6.4534656088598e-11,
   3.9163889999999994e-11
  ],
  [
   8.4296782795403e-11,
   3.8424139999999994e-11
  ],
  [
   9.452202125611024e-11,
   3.8720039999999994e-11
  ],
  [
   1.0398435445024319e-10,
   3.9163889999999994e-11
  ],
  [
   1.774205821854421e-10,
   3.7980289999999994e-11
  ],
  [
   1.9518165671416943e-10,
   3.9015939999999994e-11
  ],
  [
   2.2307350957073918e-10,
   3.9607739999999994e-11
  ],
  [
   2.751724813029096e-10,
   3.931183999999999e-11
  ],
  [
   3.0855102963939715e-10,
   3.931183999999999e-11
  ],
  [
   3.594371814086689e-10,
   3.8720039999999994e-11
  ],
  [
   4.695058414536392e-10,
   3.857208999999999e-11
  ],
  [
   6.13280279728383e-10,
   3.8867989999999994e-11
  ],
  [
   8.010820490310388e-10,
   3.9015939999999994e-11
  ],
  [
   1.2189643377411033e-09,
   3.8867989999999994e-11
  ],
  [
   1.3931568029453037e-09,
   3.8867989999999994e-11
  ],
  [
   1.56214736285608e-09,
   3.9459789999999994e-11
  ],
  [
   2.377037318363493e-09,
   3.9459789999999994e-11
  ],
  [
   2.8767756893889105e-09,
   3.8424139999999994e-11
  ],
  [
   3.83010782167685e-09,
   3.9163889999999994e-11
  ],
  [
   4.635333650009356e-09,
   3.9015939999999994e-11
  ],
  [
   5.940349535359487e-09,
   3.8867989999999994e-11
  ],
  [
   7.468888911346847e-09,
   3.857208999999999e-11
  ],
  [
   9.213253058446909e-09,
   3.8720039999999994e-11
  ],
  [
   1.052984552396157e-08,
   3.6796689999999994e-11
  ],
  [
   1.484526655498203e-08,
   3.4429489999999994e-11
  ],
  [
   1.6966685121351126e-08,
   3.309793999999999e-11
  ],
  [
   1.976482621041354e-08,
   3.3541789999999994e-11
  ],
  [
   2.174342726698982e-08,
   3.9015939999999994e-11
  ],
  [
   2.6314674356369194e-08,
   4.1974939999999994e-11
  ],
  [
   3.007509445666189e-08,
   4.0643389999999994e-11
  ],
  [
   3.308582741404209e-08,
   3.738848999999999e-11
  ],
  [
   3.709915347180509e-08,
   3.620488999999999e-11
  ],
  [
   4.081304518407959e-08,
   3.857208999999999e-11
  ],
  [
   5.131484246830978e-08,
   3.9015939999999994e-11
  ],
  [
   6.832002238858557e-08,
   3.8720039999999994e-11
  ],
  [
   7.515934731076217e-08,
   4.049543999999999e-11
  ],
  [
   8.268333777834877e-08,
   4.212288999999999e-11
  ],
  [
   1.0800304499851303e-07,
   4.1974939999999994e-11
  ],
  [
   1.234368982092758e-07,
   4.3898289999999993e-11
  ],
  [
   1.3579381825589366e-07,
   4.5525739999999993e-11
  ],
  [
   1.522656707645062e-07,
   4.6709339999999993e-11
  ],
  [
   1.9144586916685332e-07,
   4.5673689999999993e-11
  ],
  [
   2.106109756534018e-07,
   4.1826989999999994e-11
  ],
  [
   2.3169464694492245e-07,
   4.996423999999999e-11
  ],
  [
   2.54888945157712e-07,
   5.7361739999999986e-11
  ],
  [
   2.8040515920531885e-07,
   6.194818999999999e-11
  ],
  [
   3.0847572953903465e-07,
   6.742233999999999e-11
  ],
  [
   3.393563655687356e-07,
   7.496778999999999e-11
  ],
  [
   3.805204485387975e-07,
   8.473248999999999e-11
  ]
 ],
 "data_source": "figure_vision",
 "dm_density_assumed": null,
 "confidence_level": 0.95,
 "extraction_confidence": 0.85,
 "suggested_experiment_name": "HAWC_2022",
 "coupling_convention": "g_agamma [GeV^-1]",
 "notes": "Upper boundary of excluded region from Figure 3. Combined constraint from TeV blazars observed by HAWC. The filled region shows ALP parameter space excluded at >3\u03c3 significance.",
 "num_points": 60,
 "arxiv_id": "2203.04332",
 "elapsed_s": 149.63609099388123,
 "meta": {
  "system": "agent_claude_code",
  "driver_version": "0.1.4",
  "task_card_sha256": "8504fc84a3b55be2f4639757d6c68fbd107d634ff847fc99b954263eb31c415f",
  "model_requested": "claude-haiku-4-5-20251001",
  "models_billed": [
   "claude-haiku-4-5-20251001"
  ],
  "effort": "default",
  "transport": "cli",
  "timed_out": false,
  "wrote_result_json": true,
  "cli_is_error": false,
  "cli_subtype": "success",
  "cli_returncode": 0,
  "num_turns": 22,
  "duration_ms": 149335,
  "duration_api_ms": 143992,
  "total_cost_usd": 0.2723764,
  "usage": {
   "input_tokens": 160,
   "output_tokens": 16277,
   "cache_creation_input_tokens": 56480,
   "cache_read_input_tokens": 778714
  },
  "leak_suspect": false,
  "leak_patterns": [],
  "schema_problems": [],
  "events_file": "2203.04332.events.jsonl",
  "attempt": 0,
  "finished_at": "2026-09-17T18:25:06-0500"
 }
}