{
 "paper_title": "Prospects of nuclear-coupled-dark-matter detection via correlation spectroscopy of I2+ and Ca+",
 "coupling_type": "AxionMass",
 "is_new_limit": false,
 "is_projection": true,
 "data_points": [],
 "data_source": "none",
 "dm_density_assumed": 0.4,
 "confidence_level": 0.95,
 "extraction_confidence": 0.95,
 "suggested_experiment_name": "I2Ca_CorrelationSpectroscopy_2024",
 "coupling_convention": "1/f_a [GeV^-1]",
 "notes": "Proposal/projection paper: proposes correlation spectroscopy between an I2+ molecular-ion vibrational transition and the Ca+ optical clock to search for oscillations of the proton-to-electron mass ratio induced by gluon-coupled ULDM. Figure 3 shows only projected sensitivities ('this work', thick red line) on the scalar-gluon coupling dg (panel a) and on the axion decay constant 1/fa (panel b), over roughly 10^-21 to 10^-14 eV. No measurement is performed and no new experimental limit is derived, so no data points are reported. Paper assumes local DM density rho_DM = 0.4 GeV/cm^3.",
 "num_points": 0,
 "arxiv_id": "2404.00616",
 "elapsed_s": 32.001935958862305,
 "meta": {
  "system": "agent_claude_code",
  "driver_version": "0.1.3",
  "task_card_sha256": "a0c46fcf88d6d7e27541d581beca41cb13bf55348ca3a60d08b18b218df4dadd",
  "model_requested": "claude-fable-5",
  "models_billed": [
   "claude-fable-5"
  ],
  "effort": "default",
  "transport": "cli",
  "timed_out": false,
  "wrote_result_json": true,
  "cli_is_error": false,
  "cli_subtype": "success",
  "cli_returncode": 0,
  "num_turns": 4,
  "duration_ms": 31684,
  "duration_api_ms": 30638,
  "total_cost_usd": 0.4387435,
  "usage": {
   "input_tokens": 102,
   "output_tokens": 1657,
   "cache_creation_input_tokens": 19096,
   "cache_read_input_tokens": 57801
  },
  "leak_suspect": false,
  "leak_patterns": [],
  "schema_problems": [],
  "events_file": "2404.00616.events.jsonl",
  "attempt": 0,
  "finished_at": "2026-09-16T12:50:18-0500",
  "leak_audit": "strict-v2 (agent-issued only)"
 }
}