{
 "paper_title": "Search for Spectral Irregularities due to Photon-Axionlike-Particle Oscillations with the Fermi Large Area Telescope",
 "coupling_type": "AxionPhoton",
 "is_new_limit": true,
 "is_projection": false,
 "data_points": [
  [
   3.3356e-08,
   7.0001e-11
  ],
  [
   2.294e-08,
   3.4277e-11
  ],
  [
   1.6134e-08,
   2.1549e-11
  ],
  [
   1.2194e-08,
   1.2172e-11
  ],
  [
   1.1183e-08,
   1.1255e-11
  ],
  [
   7.327e-09,
   9.3282e-12
  ],
  [
   5.2459e-09,
   6.1767e-12
  ],
  [
   4.6198e-09,
   5.616e-12
  ],
  [
   3.8121e-09,
   5.3905e-12
  ],
  [
   2.4035e-09,
   5.6399e-12
  ],
  [
   1.5748e-09,
   4.944e-12
  ],
  [
   5.7975e-10,
   4.6813e-12
  ],
  [
   4.4299e-10,
   5.2037e-12
  ],
  [
   3.4674e-10,
   6.875e-12
  ],
  [
   3.0838e-10,
   1.0552e-11
  ],
  [
   3.3012e-10,
   1.9361e-11
  ],
  [
   4.5287e-10,
   3.3075e-11
  ],
  [
   4.9713e-10,
   3.5949e-11
  ],
  [
   7.0259e-10,
   3.7225e-11
  ],
  [
   1.121e-09,
   3.1915e-11
  ],
  [
   1.4583e-09,
   3.2586e-11
  ],
  [
   2.034e-09,
   4.0976e-11
  ],
  [
   2.6642e-09,
   5.8557e-11
  ],
  [
   2.8592e-09,
   7.0001e-11
  ],
  [
   3.3356e-08,
   7.0001e-11
  ]
 ],
 "data_source": "figure_vector",
 "dm_density_assumed": null,
 "confidence_level": 0.95,
 "extraction_confidence": 0.85,
 "suggested_experiment_name": "FermiLAT_NGC1275_2016",
 "coupling_convention": "g_agamma [GeV^-1]",
 "notes": "Observed 95% CL excluded region for photon-ALP oscillations in the gamma-ray spectrum of NGC 1275 (Fermi-LAT, 6 yr Pass 8). Curve is the black solid 'Observed' contour from Fig. 2 left panel (fig2a.pdf), extracted from the vector path (get_drawings path 111). Plot axes: x = m_a in neV (converted to eV), y = g_agamma in units of 10^-11 GeV^-1 (converted to GeV^-1 via g_agamma = g11 x 1e-11). Axis calibration from tick strokes; x decade 165.4pt (10^0,10^1,10^2 neV at x=187.6,353.0,518.4), y decade 175.6pt (g11=0.1 at y=367.2, g11=1 at y=191.6). Cross-checked: contour lower edge min g11=0.47 (~5e-12 GeV^-1) matches abstract 'exclude couplings above 5e-12 GeV^-1 for 0.5<~m_a<~5 neV'. The excluded region is a CLOSED contour (a 2D blob), so points trace the loop and are NOT monotonic in mass: they start at the top-right (m=33 neV, g=7e-11), follow the descending right edge down and the lower boundary leftward, up the left edge, and back across the top frame (g11=7, the upper edge of the tested grid 0.1<=g11<=7). The top edge at g11=7e-11 is the plotted grid boundary, not a physical upper limit. There is a small interior 'hole' region (Fig.2, ~2.5-4 neV around g11~2, path 109) where P_gamma-gamma fluctuates and parameters cannot be excluded; not included here (outer boundary only). Not a haloscope: limit is independent of DM density. Red dashed curve is median expected (not reported).",
 "num_points": 25,
 "arxiv_id": "1603.06978",
 "elapsed_s": 140.44301509857178,
 "meta": {
  "system": "agent_claude_code",
  "driver_version": "0.1.4",
  "task_card_sha256": "8504fc84a3b55be2f4639757d6c68fbd107d634ff847fc99b954263eb31c415f",
  "model_requested": "claude-opus-4-8",
  "models_billed": [
   "claude-opus-4-8"
  ],
  "effort": "default",
  "transport": "cli",
  "timed_out": false,
  "wrote_result_json": true,
  "cli_is_error": false,
  "cli_subtype": "success",
  "cli_returncode": 0,
  "num_turns": 15,
  "duration_ms": 140130,
  "duration_api_ms": 135551,
  "total_cost_usd": 0.8681949999999999,
  "usage": {
   "input_tokens": 384,
   "output_tokens": 10312,
   "cache_creation_input_tokens": 42000,
   "cache_read_input_tokens": 376950
  },
  "leak_suspect": false,
  "leak_patterns": [],
  "schema_problems": [],
  "events_file": "1603.06978.events.jsonl",
  "attempt": 0,
  "finished_at": "2026-09-17T21:41:48-0500"
 }
}