{
 "paper_title": "Black hole superradiance of self-interacting scalar fields",
 "coupling_type": "AxionMass",
 "is_new_limit": true,
 "is_projection": false,
 "data_points": [
  [
   2.717e-13,
   2.831e-15
  ],
  [
   5.58e-13,
   2.082e-14
  ],
  [
   7.441e-13,
   4.428e-14
  ],
  [
   9.922e-13,
   9.032e-14
  ],
  [
   1.471e-12,
   2.142e-13
  ],
  [
   1.819e-12,
   3.098e-13
  ],
  [
   2.053e-12,
   3.663e-13
  ],
  [
   2.283e-12,
   4.085e-13
  ],
  [
   2.557e-12,
   4.913e-13
  ],
  [
   3.09e-12,
   6.265e-13
  ],
  [
   3.161e-12,
   6.265e-13
  ],
  [
   3.234e-12,
   6.11e-13
  ],
  [
   3.436e-12,
   4.954e-13
  ]
 ],
 "data_source": "figure_vector",
 "dm_density_assumed": null,
 "confidence_level": 0.95,
 "extraction_confidence": 0.55,
 "suggested_experiment_name": "BHSuperradiance_2021",
 "coupling_convention": "1/f_a [GeV^-1]",
 "notes": "Headline constraint from Fig. 10 (fabounds.pdf in e-print), \"Constraints on axion parameter space from black hole spin measurements in X-ray binaries\". Plane is (mu [eV], GeV/f), i.e. inverse decay constant 1/f vs boson mass. The paper defines f via lambda == mu^2/f^2 (Eq. 8 quartic self-coupling) and equates f ~ f_a (symmetry-breaking scale) for axion-like particles; reported here as 1/f_a [GeV^-1]. For the QCD axion specifically 1/f = sqrt(0.3)/f_a ~ 0.55/f_a (from lambda ~ 0.3 mu^2/f_a^2, Eq. 5), so a factor <~2 offset from the strict canonical f_a there. Curve = upper boundary (max 1/f excluded) of the UNION of the five per-BH solid-line \"high-confidence\" spin-down regions (Cyg X-1, GRS 1915+105, M33, GRO J1655-40, LMC X-1), extracted by rasterizing the vector closed paths and taking the per-mass-column top edge; Cyg X-1 dominates the envelope. The excluded region extends down to arbitrarily small 1/f (small self-interaction does not remove the gravitational spin-down bound), so only the upper frontier is physical; the plot bottom (1e-19) is an artifact. This is the m=1 main blob (mu ~ 2.7e-13 to 3.4e-12 eV, peak 1/f ~ 6.3e-13 GeV^-1 at mu ~ 3.1e-12 eV). A separate small m=2 region at higher mass (mu ~ 3.5e-12 to 6.1e-12 eV) sits far lower at 1/f ~ 4e-18 GeV^-1 and is not included in this monotonic curve. New bound derived by this paper (novel superradiance-with-self-interactions analysis of existing X-ray-binary BH spin data; paper states it constrains masses a factor ~2 lighter than prior work). Solid line = \"spin-down with high confidence given measured-parameter uncertainties\"; paper does not attach a numerical CL to it (the 90% statements in the text concern a separate future-LIGO forecast), so confidence_level=null. Independent of DM density (superradiance does not require a pre-existing abundance).",
 "num_points": 13,
 "arxiv_id": "2011.11646",
 "elapsed_s": 363.94240403175354,
 "meta": {
  "system": "agent_claude_code",
  "driver_version": "0.1.4",
  "task_card_sha256": "8504fc84a3b55be2f4639757d6c68fbd107d634ff847fc99b954263eb31c415f",
  "model_requested": "claude-opus-4-8",
  "models_billed": [
   "claude-opus-4-8"
  ],
  "effort": "default",
  "transport": "cli",
  "timed_out": false,
  "wrote_result_json": true,
  "cli_is_error": false,
  "cli_subtype": "success",
  "cli_returncode": 0,
  "num_turns": 28,
  "duration_ms": 363585,
  "duration_api_ms": 358622,
  "total_cost_usd": 1.6651780000000003,
  "usage": {
   "input_tokens": 777,
   "output_tokens": 24017,
   "cache_creation_input_tokens": 55653,
   "cache_read_input_tokens": 1008676
  },
  "leak_suspect": false,
  "leak_patterns": [],
  "schema_problems": [],
  "events_file": "2011.11646.events.jsonl",
  "attempt": 0,
  "finished_at": "2026-09-17T23:15:53-0500"
 }
}