{
 "paper_title": "Cryogenic resonant microwave cavity searches for hidden sector photons",
 "coupling_type": "DarkPhoton",
 "is_new_limit": true,
 "is_projection": false,
 "data_points": [
  [
   1e-06,
   1.815e-07
  ],
  [
   1.738e-06,
   1.065e-06
  ],
  [
   2.188e-06,
   1.04e-06
  ],
  [
   2.754e-06,
   1.025e-06
  ],
  [
   3.467e-06,
   1.025e-06
  ],
  [
   4.365e-06,
   3.519e-08
  ],
  [
   5.495e-06,
   3.539e-08
  ],
  [
   6.918e-06,
   4.023e-08
  ],
  [
   8.71e-06,
   2.501e-05
  ],
  [
   1.096e-05,
   1.518e-05
  ],
  [
   1.38e-05,
   9.757e-06
  ],
  [
   1.738e-05,
   6.008e-06
  ],
  [
   2.188e-05,
   4.088e-06
  ],
  [
   2.754e-05,
   2.517e-06
  ],
  [
   3.467e-05,
   1.947e-06
  ],
  [
   4.365e-05,
   2.091e-06
  ],
  [
   5.495e-05,
   2.01e-07
  ],
  [
   6.918e-05,
   2.936e-08
  ],
  [
   8.71e-05,
   2.965e-08
  ]
 ],
 "data_source": "figure_vision",
 "dm_density_assumed": null,
 "confidence_level": 0.95,
 "extraction_confidence": 0.75,
 "suggested_experiment_name": "UWA_2014",
 "coupling_convention": "kinetic mixing chi (dimensionless)",
 "notes": "Boundary extracted from Figure 5 using image analysis and calibration from axis tick labels. Lower envelope (10th percentile) of excluded region used to determine limit curve. At 53 \u00b5eV verification point, extracted \u03c7=2.26e-7 vs paper \u03c7=1.7e-7 (1.33x ratio). Some scatter in extracted points likely due to figure resolution and rasterization artifacts. Main result: \u03c7 < 1.7\u00d710^-7 at 53 \u00b5eV for hidden photon mass range 240 MHz to 24 GHz.",
 "num_points": 19,
 "arxiv_id": "1410.5244",
 "elapsed_s": 322.5020339488983,
 "meta": {
  "system": "agent_claude_code",
  "driver_version": "0.1.4",
  "task_card_sha256": "8504fc84a3b55be2f4639757d6c68fbd107d634ff847fc99b954263eb31c415f",
  "model_requested": "claude-haiku-4-5-20251001",
  "models_billed": [
   "claude-haiku-4-5-20251001"
  ],
  "effort": "default",
  "transport": "cli",
  "timed_out": false,
  "wrote_result_json": true,
  "cli_is_error": false,
  "cli_subtype": "success",
  "cli_returncode": 0,
  "num_turns": 27,
  "duration_ms": 321420,
  "duration_api_ms": 300024,
  "total_cost_usd": 0.41622640000000005,
  "usage": {
   "input_tokens": 212,
   "output_tokens": 29570,
   "cache_creation_input_tokens": 70609,
   "cache_read_input_tokens": 1269464
  },
  "leak_suspect": false,
  "leak_patterns": [],
  "schema_problems": [],
  "events_file": "1410.5244.events.jsonl",
  "attempt": 0,
  "finished_at": "2026-09-17T15:00:13-0500"
 }
}