{
 "paper_title": "Leading Axion-Photon Sensitivity with NuSTAR Observations of M82 and M87",
 "coupling_type": "AxionPhoton",
 "is_new_limit": true,
 "is_projection": false,
 "data_points": [
  [
   1.0002798949010958e-13,
   6.827886704517409e-13
  ],
  [
   1.311616727335971e-13,
   6.827886704517409e-13
  ],
  [
   1.7198570602057572e-13,
   6.827886704517409e-13
  ],
  [
   2.2551620804252835e-13,
   6.828267442934996e-13
  ],
  [
   2.9570806357475147e-13,
   6.828267442934996e-13
  ],
  [
   3.8774711415260684e-13,
   6.828267442934996e-13
  ],
  [
   5.084332930125477e-13,
   6.828267442934996e-13
  ],
  [
   6.666830106744336e-13,
   6.828267442934996e-13
  ],
  [
   8.741879078932737e-13,
   6.828267442934996e-13
  ],
  [
   1.146278645279606e-12,
   6.828267442934996e-13
  ],
  [
   1.5030575471932401e-12,
   6.826769400277884e-13
  ],
  [
   1.9708837807263516e-12,
   6.82061261175323e-13
  ],
  [
   2.584320796222184e-12,
   6.801379990601546e-13
  ],
  [
   3.388689908100559e-12,
   6.742514823151739e-13
  ],
  [
   4.443418676988164e-12,
   6.577120693414862e-13
  ],
  [
   5.8264314748333545e-12,
   6.333363303019333e-13
  ],
  [
   7.639906612162626e-12,
   6.317838735120587e-13
  ],
  [
   1.0017825369556181e-11,
   6.582069008374493e-13
  ],
  [
   1.3135870663020506e-11,
   7.363453875506189e-13
  ],
  [
   1.7224406666139294e-11,
   7.219944363843282e-13
  ],
  [
   2.258549833592257e-11,
   7.451447718067285e-13
  ],
  [
   2.961522826122967e-11,
   8.35320879660175e-13
  ],
  [
   3.8832959623908776e-11,
   9.10142027256759e-13
  ],
  [
   5.091970724825705e-11,
   9.375573161228525e-13
  ],
  [
   6.676845162869968e-11,
   1.1079210355646189e-12
  ],
  [
   8.755011318425451e-11,
   1.5353789465815033e-12
  ],
  [
   1.1480006098091169e-10,
   1.9540450460188917e-12
  ],
  [
   1.5053154726921856e-10,
   2.5373383108222576e-12
  ],
  [
   1.9738444848938466e-10,
   3.2607909460909052e-12
  ],
  [
   2.588203018718682e-10,
   4.250195335225631e-12
  ],
  [
   3.3937804712435387e-10,
   5.673657820812864e-12
  ],
  [
   4.4500936764597393e-10,
   7.631253516375417e-12
  ],
  [
   5.835184065989596e-10,
   1.0182409515875601e-11
  ],
  [
   7.651383444823742e-10,
   1.4745507850145096e-11
  ],
  [
   1.0032874363114773e-09,
   2.216916322899181e-11
  ]
 ],
 "data_source": "figure_vector",
 "dm_density_assumed": null,
 "confidence_level": 0.95,
 "extraction_confidence": 0.85,
 "suggested_experiment_name": "NuSTAR_M82_2024",
 "coupling_convention": "g_agamma [GeV^-1]",
 "notes": "Headline observed limit: M82 (this work) 95% CL, the solid black lower curve in Fig.2 (fig2_041924.pdf vector drawing idx233), which sits on the green M82 Expected band. Stellar Primakoff production + conversion in M82 magnetic field, NuSTAR 30-70 keV. Flat limit ~6.4e-13 GeV^-1 for m_a<~1e-11 eV (paper quotes |g_agamma|<=6.4e-13 in massless limit), rising above ~1e-11 eV. Axes calibrated from tick labels (log-log). M87 (this work, 8.4e-13) is the weaker companion curve, not reported. Limit is astrophysical (stellar), not DM-density dependent.",
 "num_points": 35,
 "arxiv_id": "2404.14476",
 "elapsed_s": 188.91397094726562,
 "meta": {
  "system": "agent_claude_code",
  "driver_version": "0.1.4",
  "task_card_sha256": "8504fc84a3b55be2f4639757d6c68fbd107d634ff847fc99b954263eb31c415f",
  "model_requested": "claude-opus-4-8",
  "models_billed": [
   "claude-opus-4-8"
  ],
  "effort": "default",
  "transport": "cli",
  "timed_out": false,
  "wrote_result_json": true,
  "cli_is_error": false,
  "cli_subtype": "success",
  "cli_returncode": 0,
  "num_turns": 22,
  "duration_ms": 188607,
  "duration_api_ms": 184647,
  "total_cost_usd": 1.09142,
  "usage": {
   "input_tokens": 565,
   "output_tokens": 13238,
   "cache_creation_input_tokens": 43040,
   "cache_read_input_tokens": 654490
  },
  "leak_suspect": false,
  "leak_patterns": [],
  "schema_problems": [],
  "events_file": "2404.14476.events.jsonl",
  "attempt": 0,
  "finished_at": "2026-09-18T02:19:20-0500"
 }
}